{
  "schemaVersion": "1.0.0",
  "synthetic": true,
  "fixtureId": "FIX-LAB08-001",
  "generatorVersion": "1.0.0",
  "seed": 208,
  "producerId": "SYNTH-CH08-GENERATOR",
  "timeBasis": "fixed synthetic UTC; not synchronized with a real host",
  "receipts": [
    {
      "receiptId": "RCP-LAB08-001-001",
      "runId": "RUN-LAB08-SAFE",
      "synthetic": true,
      "stage": "preflight",
      "check": "authority",
      "result": "Pass",
      "observedAt": "2026-09-13T00:00:01Z",
      "producerId": "SYNTH-CH08-GENERATOR",
      "basis": "supplied synthetic control check; not a host observation"
    },
    {
      "receiptId": "RCP-LAB08-001-002",
      "runId": "RUN-LAB08-SAFE",
      "synthetic": true,
      "stage": "preflight",
      "check": "rootless",
      "result": "Pass",
      "observedAt": "2026-09-13T00:00:02Z",
      "producerId": "SYNTH-CH08-GENERATOR",
      "basis": "supplied synthetic control check; not a host observation"
    },
    {
      "receiptId": "RCP-LAB08-001-003",
      "runId": "RUN-LAB08-SAFE",
      "synthetic": true,
      "stage": "preflight",
      "check": "privileges",
      "result": "Pass",
      "observedAt": "2026-09-13T00:00:03Z",
      "producerId": "SYNTH-CH08-GENERATOR",
      "basis": "supplied synthetic control check; not a host observation"
    },
    {
      "receiptId": "RCP-LAB08-001-004",
      "runId": "RUN-LAB08-SAFE",
      "synthetic": true,
      "stage": "preflight",
      "check": "network",
      "result": "Pass",
      "observedAt": "2026-09-13T00:00:04Z",
      "producerId": "SYNTH-CH08-GENERATOR",
      "basis": "supplied synthetic control check; not a host observation"
    },
    {
      "receiptId": "RCP-LAB08-001-005",
      "runId": "RUN-LAB08-SAFE",
      "synthetic": true,
      "stage": "preflight",
      "check": "egress",
      "result": "Pass",
      "observedAt": "2026-09-13T00:00:05Z",
      "producerId": "SYNTH-CH08-GENERATOR",
      "basis": "supplied synthetic control check; not a host observation"
    },
    {
      "receiptId": "RCP-LAB08-001-006",
      "runId": "RUN-LAB08-SAFE",
      "synthetic": true,
      "stage": "preflight",
      "check": "mount",
      "result": "Pass",
      "observedAt": "2026-09-13T00:00:06Z",
      "producerId": "SYNTH-CH08-GENERATOR",
      "basis": "supplied synthetic control check; not a host observation"
    },
    {
      "receiptId": "RCP-LAB08-001-007",
      "runId": "RUN-LAB08-SAFE",
      "synthetic": true,
      "stage": "preflight",
      "check": "data",
      "result": "Pass",
      "observedAt": "2026-09-13T00:00:07Z",
      "producerId": "SYNTH-CH08-GENERATOR",
      "basis": "supplied synthetic control check; not a host observation"
    },
    {
      "receiptId": "RCP-LAB08-001-008",
      "runId": "RUN-LAB08-SAFE",
      "synthetic": true,
      "stage": "preflight",
      "check": "collection",
      "result": "Pass",
      "observedAt": "2026-09-13T00:00:08Z",
      "producerId": "SYNTH-CH08-GENERATOR",
      "basis": "supplied synthetic control check; not a host observation"
    },
    {
      "receiptId": "RCP-LAB08-001-009",
      "runId": "RUN-LAB08-SAFE",
      "synthetic": true,
      "stage": "runtime",
      "check": "egress",
      "result": "Pass",
      "observedAt": "2026-09-13T00:00:09Z",
      "producerId": "SYNTH-CH08-GENERATOR",
      "basis": "supplied synthetic control check; not a host observation"
    },
    {
      "receiptId": "RCP-LAB08-001-010",
      "runId": "RUN-LAB08-SAFE",
      "synthetic": true,
      "stage": "runtime",
      "check": "scope",
      "result": "Pass",
      "observedAt": "2026-09-13T00:00:10Z",
      "producerId": "SYNTH-CH08-GENERATOR",
      "basis": "supplied synthetic control check; not a host observation"
    },
    {
      "receiptId": "RCP-LAB08-001-011",
      "runId": "RUN-LAB08-SAFE",
      "synthetic": true,
      "stage": "runtime",
      "check": "privileges",
      "result": "Pass",
      "observedAt": "2026-09-13T00:00:11Z",
      "producerId": "SYNTH-CH08-GENERATOR",
      "basis": "supplied synthetic control check; not a host observation"
    },
    {
      "receiptId": "RCP-LAB08-001-012",
      "runId": "RUN-LAB08-SAFE",
      "synthetic": true,
      "stage": "runtime",
      "check": "data",
      "result": "Pass",
      "observedAt": "2026-09-13T00:00:12Z",
      "producerId": "SYNTH-CH08-GENERATOR",
      "basis": "supplied synthetic control check; not a host observation"
    },
    {
      "receiptId": "RCP-LAB08-001-013",
      "runId": "RUN-LAB08-SAFE",
      "synthetic": true,
      "stage": "runtime",
      "check": "resources",
      "result": "Pass",
      "observedAt": "2026-09-13T00:00:13Z",
      "producerId": "SYNTH-CH08-GENERATOR",
      "basis": "supplied synthetic control check; not a host observation"
    },
    {
      "receiptId": "RCP-LAB08-001-014",
      "runId": "RUN-LAB08-SAFE",
      "synthetic": true,
      "stage": "runtime",
      "check": "collection",
      "result": "Pass",
      "observedAt": "2026-09-13T00:00:14Z",
      "producerId": "SYNTH-CH08-GENERATOR",
      "basis": "supplied synthetic control check; not a host observation"
    },
    {
      "receiptId": "RCP-LAB08-001-015",
      "runId": "RUN-LAB08-SAFE",
      "synthetic": true,
      "stage": "runtime",
      "check": "clock",
      "result": "Pass",
      "observedAt": "2026-09-13T00:00:15Z",
      "producerId": "SYNTH-CH08-GENERATOR",
      "basis": "supplied synthetic control check; not a host observation"
    },
    {
      "receiptId": "RCP-LAB08-001-016",
      "runId": "RUN-LAB08-SAFE",
      "synthetic": true,
      "stage": "stop",
      "check": "stopped",
      "result": "Pass",
      "observedAt": "2026-09-13T00:00:16Z",
      "producerId": "SYNTH-CH08-GENERATOR",
      "basis": "supplied synthetic control check; not a host observation"
    },
    {
      "receiptId": "RCP-LAB08-001-017",
      "runId": "RUN-LAB08-SAFE",
      "synthetic": true,
      "stage": "export",
      "check": "evidenceExport",
      "result": "Pass",
      "observedAt": "2026-09-13T00:00:17Z",
      "producerId": "SYNTH-CH08-GENERATOR",
      "basis": "supplied synthetic control check; not a host observation"
    },
    {
      "receiptId": "RCP-LAB08-001-018",
      "runId": "RUN-LAB08-SAFE",
      "synthetic": true,
      "stage": "destroy",
      "check": "destroyed",
      "result": "Pass",
      "observedAt": "2026-09-13T00:00:18Z",
      "producerId": "SYNTH-CH08-GENERATOR",
      "basis": "supplied synthetic control check; not a host observation"
    },
    {
      "receiptId": "RCP-LAB08-001-019",
      "runId": "RUN-LAB08-SAFE",
      "synthetic": true,
      "stage": "cleanup",
      "check": "container",
      "result": "Pass",
      "observedAt": "2026-09-13T00:00:19Z",
      "producerId": "SYNTH-CH08-GENERATOR",
      "basis": "supplied synthetic control check; not a host observation"
    },
    {
      "receiptId": "RCP-LAB08-001-020",
      "runId": "RUN-LAB08-SAFE",
      "synthetic": true,
      "stage": "cleanup",
      "check": "network",
      "result": "Pass",
      "observedAt": "2026-09-13T00:00:20Z",
      "producerId": "SYNTH-CH08-GENERATOR",
      "basis": "supplied synthetic control check; not a host observation"
    },
    {
      "receiptId": "RCP-LAB08-001-021",
      "runId": "RUN-LAB08-SAFE",
      "synthetic": true,
      "stage": "cleanup",
      "check": "volume",
      "result": "Pass",
      "observedAt": "2026-09-13T00:00:21Z",
      "producerId": "SYNTH-CH08-GENERATOR",
      "basis": "supplied synthetic control check; not a host observation"
    },
    {
      "receiptId": "RCP-LAB08-001-022",
      "runId": "RUN-LAB08-SAFE",
      "synthetic": true,
      "stage": "cleanup",
      "check": "file",
      "result": "Pass",
      "observedAt": "2026-09-13T00:00:22Z",
      "producerId": "SYNTH-CH08-GENERATOR",
      "basis": "supplied synthetic control check; not a host observation"
    },
    {
      "receiptId": "RCP-LAB08-001-023",
      "runId": "RUN-LAB08-SAFE",
      "synthetic": true,
      "stage": "cleanup",
      "check": "credential",
      "result": "Pass",
      "observedAt": "2026-09-13T00:00:23Z",
      "producerId": "SYNTH-CH08-GENERATOR",
      "basis": "supplied synthetic control check; not a host observation"
    },
    {
      "receiptId": "RCP-LAB08-001-024",
      "runId": "RUN-LAB08-SAFE",
      "synthetic": true,
      "stage": "cleanup",
      "check": "port",
      "result": "Pass",
      "observedAt": "2026-09-13T00:00:24Z",
      "producerId": "SYNTH-CH08-GENERATOR",
      "basis": "supplied synthetic control check; not a host observation"
    },
    {
      "receiptId": "RCP-LAB08-002-001",
      "runId": "RUN-LAB08-UNSAFE",
      "synthetic": true,
      "stage": "preflight",
      "check": "authority",
      "result": "Pass",
      "observedAt": "2026-09-13T00:02:01Z",
      "producerId": "SYNTH-CH08-GENERATOR",
      "basis": "supplied synthetic control check; not a host observation"
    },
    {
      "receiptId": "RCP-LAB08-002-002",
      "runId": "RUN-LAB08-UNSAFE",
      "synthetic": true,
      "stage": "preflight",
      "check": "rootless",
      "result": "Pass",
      "observedAt": "2026-09-13T00:02:02Z",
      "producerId": "SYNTH-CH08-GENERATOR",
      "basis": "supplied synthetic control check; not a host observation"
    },
    {
      "receiptId": "RCP-LAB08-002-003",
      "runId": "RUN-LAB08-UNSAFE",
      "synthetic": true,
      "stage": "preflight",
      "check": "privileges",
      "result": "Pass",
      "observedAt": "2026-09-13T00:02:03Z",
      "producerId": "SYNTH-CH08-GENERATOR",
      "basis": "supplied synthetic control check; not a host observation"
    },
    {
      "receiptId": "RCP-LAB08-002-004",
      "runId": "RUN-LAB08-UNSAFE",
      "synthetic": true,
      "stage": "preflight",
      "check": "network",
      "result": "Pass",
      "observedAt": "2026-09-13T00:02:04Z",
      "producerId": "SYNTH-CH08-GENERATOR",